{"plain": " The user's favourite genre is likely to be science fiction, as evidenced by the inclusion of \"Star Wars\", \"2001: A Space Odyssey\", \"Aliens\", \"Mad Max\", and \"Firestarter\" in their list of favourite movies. The user also seems to enjoy fantasy, as evidenced by \"Aladdin\" and \"The Running Man\" being on their list. Additionally, the user appears to enjoy horror, as evidenced by \"The Silence of the Lambs\" being on their list. The user's favourite kind of plot is likely to be complex and multi-layered, as evidenced by the inclusion of \"All About Eve\", \"The Paper Chase\", and \"Big Trouble in Little China\" on their list. The user's favourite kind of musical score is likely to be epic and orchestral, as evidenced by the inclusion of \"Star Wars\", \"2001: A Space Odyssey\", and \"The 7th Voyage of Sinbad\" on their list. The user's favourite mood for the musical score is likely to be serious and dramatic, as evidenced by the inclusion of \"Star Wars\", \"2001: A Space Odyssey\", and \"The Silence of the Lambs\" on their list. The user's favourite setting is likely to be a combination of futuristic and fantasy worlds, as evidenced by the inclusion of \"Star Wars\", \"2001: A Space Odyssey\", \"Aladdin\", and \"The Running Man\" on their list. The user's favourite visual style is likely to be a combination of futuristic and fantasy visuals, as evidenced by the inclusion of \"Star Wars\", \"2001: A Space Odyssey\", \"Aladdin\", and \"The Running Man\" on their list. The user's favourite writing style is likely to be a combination of complex and multi-layered storytelling, as evidenced by the inclusion of \"All About Eve\", \"The Paper Chase\", and \"Big Trouble in Little China\" on their list. The user's favourite runtime is likely to be between 90 and 120 minutes, as evidenced by the inclusion of \"Star Wars\", \"2001: A Space Odyssey\", \"The Silence of the Lambs\", and \"The Paper Chase\" on their list. The user's favourite themes are likely to be science fiction, fantasy, and horror, as evidenced by the inclusion of \"Star Wars\", \"2001: A Space Odyssey\", \"Aladdin\", \"The Silence of the Lambs\", and \"The Running Man\" on their list.", "the user's favourite genre is likely to be science fiction, as evidenced by the inclusion of \"star wars\", \"2001": ["a space odyssey\"", "\"aliens\"", "\"mad max\"", "and \"firestarter\" in their list of favourite movies"], "the user's favourite kind of musical score is likely to be epic and orchestral, as evidenced by the inclusion of \"star wars\", \"2001": ["a space odyssey\"", "and \"the 7th voyage of sinbad\" on their list"], "the user's favourite mood for the musical score is likely to be serious and dramatic, as evidenced by the inclusion of \"star wars\", \"2001": ["a space odyssey\"", "and \"the silence of the lambs\" on their list"], "the user's favourite setting is likely to be a combination of futuristic and fantasy worlds, as evidenced by the inclusion of \"star wars\", \"2001": ["a space odyssey\"", "\"aladdin\"", "and \"the running man\" on their list"], "the user's favourite visual style is likely to be a combination of futuristic and fantasy visuals, as evidenced by the inclusion of \"star wars\", \"2001": ["a space odyssey\"", "\"aladdin\"", "and \"the running man\" on their list"], "the user's favourite runtime is likely to be between 90 and 120 minutes, as evidenced by the inclusion of \"star wars\", \"2001": ["a space odyssey\"", "\"the silence of the lambs\"", "and \"the paper chase\" on their list"], "the user's favourite themes are likely to be science fiction, fantasy, and horror, as evidenced by the inclusion of \"star wars\", \"2001": ["a space odyssey\"", "\"aladdin\"", "\"the silence of the lambs\"", "and \"the running man\" on their list"]}