{"plain": "Based on the user's favourite movies, it can be inferred that their favourite genre is science fiction. The user's favourite kind of plot is likely to be complex and thought-provoking, as evidenced by the inclusion of movies such as \"12 Monkeys\" and \"Contact.\" The user's favourite kind of musical score is likely to be epic and grand, as evidenced by the inclusion of movies such as \"Star Wars Episode VI: Return of the Jedi\" and \"The Fifth Element.\" The user's favourite mood for the musical score is likely to be uplifting and inspiring, as evidenced by the inclusion of movies such as \"Star Trek: First Contact\" and \"Mad Max Beyond Thunderdome.\" The user's favourite setting is likely to be futuristic or outer space, as evidenced by the inclusion of movies such as \"2001: A Space Odyssey\" and \"The Fifth Element.\" The user's favourite visual style is likely to be highly detailed and immersive, as evidenced by the inclusion of movies such as \"Star Wars Episode I: The Phantom Menace\" and \"Planet of the Apes.\" The user's favourite writing style is likely to be complex and well-crafted, as evidenced by the inclusion of movies such as \"12 Monkeys\" and \"Contact.\" The user's favourite runtime is likely to be around two hours, as evidenced by the inclusion of movies such as \"Terminator 2: Judgment Day\" and \"Face-Off.\" The user's favourite themes are likely to be time travel, artificial intelligence, and the nature of reality, as evidenced by the inclusion of movies such as \"12 Monkeys,\" \"Terminator 2: Judgment Day,\" and \"Contact.\"", "\" the user's favourite kind of musical score is likely to be epic and grand, as evidenced by the inclusion of movies such as \"star wars episode vi": ["return of the jedi\" and \"the fifth element"], "\" the user's favourite mood for the musical score is likely to be uplifting and inspiring, as evidenced by the inclusion of movies such as \"star trek": ["first contact\" and \"mad max beyond thunderdome"], "\" the user's favourite setting is likely to be futuristic or outer space, as evidenced by the inclusion of movies such as \"2001": ["a space odyssey\" and \"the fifth element"], "\" the user's favourite visual style is likely to be highly detailed and immersive, as evidenced by the inclusion of movies such as \"star wars episode i": ["the phantom menace\" and \"planet of the apes"], "\" the user's favourite runtime is likely to be around two hours, as evidenced by the inclusion of movies such as \"terminator 2": ["judgment day\" and \"face-off"], "\" the user's favourite themes are likely to be time travel, artificial intelligence, and the nature of reality, as evidenced by the inclusion of movies such as \"12 monkeys,\" \"terminator 2": ["judgment day,\" and \"contact"]}