{"plain": " Most likely, the user enjoys movies that are:\n- Action/Thriller: The user likes movies with a lot of action and suspense, such as \"The Usual Suspects\" and \"Reservoir Dogs.\"\n- Drama: The user also enjoys movies with a strong emotional component, such as \"Braveheart,\" \"To Kill a Mockingbird,\" and \"Good Will Hunting.\"\n- Mystery: The user likes movies that keep them guessing, such as \"The Silence of the Lambs\" and \"Stir of Echoes.\"\n- Historical: The user enjoys movies that are set in historical periods, such as \"Schindler's List\" and \"Alive.\"\n- Fantasy: The user likes movies that have a touch of magic or the supernatural, such as \"The Sixth Sense\" and \"American Beauty.\"\n\nThe user likely enjoys movies with a complex plot that keeps them engaged and guessing. They may also prefer movies with a strong emotional component and a touch of mystery or fantasy. The user's taste in movies suggests they enjoy a wide range of genres and themes, and are not limited to any specific style or setting.", "most likely, the user enjoys movies that are:\n- action/thriller": ["the user likes movies with a lot of action and suspense", "such as \"the usual suspects\" and \"reservoir dogs"], "\"\n- drama": ["the user also enjoys movies with a strong emotional component", "such as \"braveheart,\" \"to kill a mockingbird,\" and \"good will hunting"], "\"\n- mystery": ["the user likes movies that keep them guessing", "such as \"the silence of the lambs\" and \"stir of echoes"], "\"\n- historical": ["the user enjoys movies that are set in historical periods", "such as \"schindler's list\" and \"alive"], "\"\n- fantasy": ["the user likes movies that have a touch of magic or the supernatural", "such as \"the sixth sense\" and \"american beauty"]}