{"plain": " The user's favourite genre is likely action, as evidenced by the presence of movies like Braveheart, Jurassic Park, Terminator 2: Judgment Day, Kingpin, and The Prince of Egypt. The user's favourite kind of plot is likely to be complex and multi-layered, as evidenced by the presence of movies like Pi, Return to Oz, Rushmore, Office Space, 10 Things I Hate About You, Never Been Kissed, Election, Existenz, Entrapment, Austin Powers: The Spy Who Shagged Me, Run Lola Run, Fight Club, Man on the Moon, Galaxy Quest, Snow Falling on Cedars, Boiler Room, High Fidelity, U-571, Gladiator, Mission: Impossible II, Shanghai Noon, and X-Men. The user's favourite kind of musical score is likely to be epic and dramatic, as evidenced by the presence of movies like Braveheart, Jurassic Park, Terminator 2: Judgment Day, The Prince of Egypt, Gladiator, and Mission: Impossible II. The user's favourite mood for the musical score is likely to be serious and intense, as evidenced by the presence of movies like Braveheart, Jurassic Park, Terminator 2: Judgment Day, The Prince of Egypt, Gladiator, and Mission: Impossible II. The user's favourite setting is likely to be historical or fantasy, as evidenced by the presence of movies like Braveheart, Return to Oz, The Prince of Egypt, and A Fistful of Dollars. The user's favourite visual style is likely to be realistic and immersive, as evidenced by the presence of movies like Jurassic Park, Terminator 2: Judgment Day, The Prince of Egypt, Gladiator, and Mission: Impossible II. The user's favourite writing style is likely to be complex and multi-layered, as evidenced by the presence of movies like Pi, Return to Oz, Rushmore, Office Space, 10 Things I Hate About You, Never Been Kissed, Election, Existenz, Entrapment, Austin Powers: The Spy Who Shagged Me, Run Lola Run, Fight Club, Man on the Moon, Galaxy Quest, Snow Falling on Cedars, Boiler Room, High Fidelity, U-571, Gladiator, Mission: Impossible II, Shanghai Noon, and X-Men. The user's favourite runtime is likely to be between 90 minutes and 120 minutes, as evidenced by the presence of movies like Braveheart, Jurassic Park, Terminator 2: Judgment Day, The Prince of Egypt, Gladiator, and Mission: Impossible II. The user's favourite themes", "the user's favourite genre is likely action, as evidenced by the presence of movies like braveheart, jurassic park, terminator 2": ["judgment day", "kingpin", "and the prince of egypt"], "the user's favourite kind of plot is likely to be complex and multi-layered, as evidenced by the presence of movies like pi, return to oz, rushmore, office space, 10 things i hate about you, never been kissed, election, existenz, entrapment, austin powers": ["the spy who shagged me", "run lola run", "fight club", "man on the moon", "galaxy quest", "snow falling on cedars", "boiler room", "high fidelity", "u-571", "gladiator", "mission"], "the user's favourite kind of musical score is likely to be epic and dramatic, as evidenced by the presence of movies like braveheart, jurassic park, terminator 2": ["judgment day", "the prince of egypt", "gladiator", "and mission"], "the user's favourite mood for the musical score is likely to be serious and intense, as evidenced by the presence of movies like braveheart, jurassic park, terminator 2": ["judgment day", "the prince of egypt", "gladiator", "and mission"], "the user's favourite visual style is likely to be realistic and immersive, as evidenced by the presence of movies like jurassic park, terminator 2": ["judgment day", "the prince of egypt", "gladiator", "and mission"], "the user's favourite writing style is likely to be complex and multi-layered, as evidenced by the presence of movies like pi, return to oz, rushmore, office space, 10 things i hate about you, never been kissed, election, existenz, entrapment, austin powers": ["the spy who shagged me", "run lola run", "fight club", "man on the moon", "galaxy quest", "snow falling on cedars", "boiler room", "high fidelity", "u-571", "gladiator", "mission"], "the user's favourite runtime is likely to be between 90 minutes and 120 minutes, as evidenced by the presence of movies like braveheart, jurassic park, terminator 2": ["judgment day", "the prince of egypt", "gladiator", "and mission"]}